{
  "registry_id": "PEP-BIB-REGISTRY",
  "version": "v0.1",
  "description": "Peptide science bibliography and source registry covering history, chemistry, biology, measurement, therapeutics, materials, computation, standards, and regulation",
  "domain_coverage": [
    "terminology",
    "chemistry",
    "endocrine_history",
    "sequencing",
    "chromatography",
    "immunoassay",
    "mass_spectrometry",
    "structural_methods",
    "proteomics",
    "peptidomics",
    "degradomics",
    "immunopeptidomics",
    "ripps",
    "nonribosomal",
    "micropeptides",
    "pharmacology",
    "medicinal_chemistry",
    "delivery",
    "pk_pd",
    "toxicology",
    "cmc",
    "regulation",
    "self_assembly",
    "biomaterials",
    "nanotechnology",
    "chemical_biology",
    "computational_chemistry",
    "bioinformatics",
    "generative_design",
    "dataset_governance",
    "provenance",
    "fair_data",
    "persistent_identifiers",
    "machine_readable_standards"
  ],
  "source_count_by_class": {
    "primary_research": 12,
    "official_historical": 2,
    "regulatory": 1,
    "standard": 3,
    "database": 2,
    "nomenclature": 2,
    "review": 1,
    "discovery_aid": 1
  },
  "sources": [
    {
      "source_id": "PEP-IUPAC-2013",
      "title": "Nomenclature and Symbolism for Amino Acids and Peptides (IUPAC Recommendations)",
      "authors_or_organization": "IUPAC-IUB Joint Commission on Biochemical Nomenclature",
      "year": 2013,
      "source_type": "nomenclature",
      "authority_posture": "official_standards",
      "primary_or_secondary": "primary",
      "url": "https://www.qmul.ac.uk/sbcs/iupac/AminoAcid/",
      "accessed_date": "2026-07-10",
      "document_status": "active",
      "license_or_access": "public",
      "retraction_or_correction_status": "none",
      "claims_supported": ["peptide_terminology", "amino_acid_nomenclature", "sequence_notation"],
      "notes": "Authoritative nomenclature source for peptide terminology and boundary conventions"
    },
    {
      "source_id": "PEP-BAYLISS-1902",
      "title": "The mechanism of pancreatic secretion",
      "authors_or_organization": "Bayliss, W.M. and Starling, E.H.",
      "year": 1902,
      "source_type": "primary_research",
      "authority_posture": "primary_experimental",
      "primary_or_secondary": "primary",
      "doi": "10.1113/jphysiol.1902.sp000920",
      "url": "https://physoc.onlinelibrary.wiley.com/doi/10.1113/jphysiol.1902.sp000920",
      "accessed_date": "2026-07-10",
      "document_status": "active",
      "license_or_access": "subscription",
      "retraction_or_correction_status": "none",
      "claims_supported": ["secretin_discovery", "first_peptide_hormone", "endocrine_signaling_origin"],
      "exact_locators": "J Physiol 28:325-353",
      "notes": "Foundational paper establishing peptide hormonal signaling"
    },
    {
      "source_id": "PEP-NOBEL-INSULIN-1923",
      "title": "The Nobel Prize in Physiology or Medicine 1923 — Nobel Lecture",
      "authors_or_organization": "Nobel Foundation",
      "year": 1923,
      "source_type": "official_historical",
      "authority_posture": "official_standards",
      "primary_or_secondary": "secondary",
      "url": "https://www.nobelprize.org/prizes/medicine/1923/",
      "accessed_date": "2026-07-10",
      "document_status": "active",
      "license_or_access": "public",
      "retraction_or_correction_status": "none",
      "claims_supported": ["insulin_discovery_history", "banting_macleod", "nobel_attribution"],
      "notes": "Official Nobel historical record for insulin discovery"
    },
    {
      "source_id": "PEP-SANGER-1955",
      "title": "The structure of insulin",
      "authors_or_organization": "Sanger, F.",
      "year": 1955,
      "source_type": "primary_research",
      "authority_posture": "primary_experimental",
      "primary_or_secondary": "primary",
      "doi": "10.1042/bj0590509",
      "url": "https://www.ncbi.nlm.nih.gov/pmc/articles/PMC1216549/",
      "pmid": 13247034,
      "accessed_date": "2026-07-10",
      "document_status": "active",
      "license_or_access": "public",
      "retraction_or_correction_status": "none",
      "claims_supported": ["first_protein_sequence", "insulin_sequence", "sequencing_method"],
      "exact_locators": "Biochem J 59:509-515",
      "notes": "First determination of a protein/peptide sequence"
    },
    {
      "source_id": "PEP-DUVIGNEAUD-1953",
      "title": "The synthesis of oxytocin",
      "authors_or_organization": "du Vigneaud, V. et al.",
      "year": 1953,
      "source_type": "primary_research",
      "authority_posture": "primary_experimental",
      "primary_or_secondary": "primary",
      "doi": "10.1021/ja01114a516",
      "accessed_date": "2026-07-10",
      "document_status": "active",
      "license_or_access": "subscription",
      "retraction_or_correction_status": "none",
      "claims_supported": ["first_peptide_hormone_synthesis", "oxytocin_synthesis", "nobel_1955"],
      "exact_locators": "J Am Chem Soc 75:4879-4880",
      "notes": "First chemical synthesis of a peptide hormone"
    },
    {
      "source_id": "PEP-MERRIFIELD-1963",
      "title": "Solid Phase Peptide Synthesis. I. The Synthesis of a Tetrapeptide",
      "authors_or_organization": "Merrifield, R.B.",
      "year": 1963,
      "source_type": "primary_research",
      "authority_posture": "primary_experimental",
      "primary_or_secondary": "primary",
      "doi": "10.1021/ja00897a025",
      "accessed_date": "2026-07-10",
      "document_status": "active",
      "license_or_access": "subscription",
      "retraction_or_correction_status": "none",
      "claims_supported": ["spps_invention", "solid_phase_synthesis", "automated_synthesis_foundation"],
      "exact_locators": "J Am Chem Soc 85:2149-2154",
      "notes": "Foundational paper for solid-phase peptide synthesis"
    },
    {
      "source_id": "PEP-EDMAN-1950",
      "title": "Method for determination of the amino acid sequence in peptides",
      "authors_or_organization": "Edman, P.",
      "year": 1950,
      "source_type": "primary_research",
      "authority_posture": "primary_experimental",
      "primary_or_secondary": "primary",
      "doi": "10.1111/j.1749-6632.1950.tb32097.x",
      "accessed_date": "2026-07-10",
      "document_status": "active",
      "license_or_access": "subscription",
      "retraction_or_correction_status": "none",
      "claims_supported": ["edman_degradation", "sequencing_method", "n_terminal_sequencing"],
      "exact_locators": "Acta Chem Scand 4:283-293",
      "notes": "Foundational paper for Edman degradation sequencing"
    },
    {
      "source_id": "PEP-YALOW-1960",
      "title": "Immunoassay of endogenous plasma insulin in man",
      "authors_or_organization": "Yalow, R.S. and Berson, S.A.",
      "year": 1960,
      "source_type": "primary_research",
      "authority_posture": "primary_experimental",
      "primary_or_secondary": "primary",
      "doi": "10.1210/jcem-20-10-1259",
      "pmid": 13775404,
      "accessed_date": "2026-07-10",
      "document_status": "active",
      "license_or_access": "subscription",
      "retraction_or_correction_status": "none",
      "claims_supported": ["radioimmunoassay_invention", "insulin_measurement", "immunoassay_foundation"],
      "exact_locators": "J Clin Invest 39:1157-1175",
      "notes": "Foundational paper for radioimmunoassay"
    },
    {
      "source_id": "PEP-SMITH-1985",
      "title": "Filamentous fusion phage: novel expression vectors that display cloned antigens on the virion surface",
      "authors_or_organization": "Smith, G.P.",
      "year": 1985,
      "source_type": "primary_research",
      "authority_posture": "primary_experimental",
      "primary_or_secondary": "primary",
      "doi": "10.1128/science.4001944",
      "pmid": 4001944,
      "accessed_date": "2026-07-10",
      "document_status": "active",
      "license_or_access": "subscription",
      "retraction_or_correction_status": "none",
      "claims_supported": ["phage_display_invention", "peptide_display", "affinity_selection"],
      "exact_locators": "Science 228:1315-1317",
      "notes": "Foundational paper for phage display"
    },
    {
      "source_id": "PEP-DAWSON-1994",
      "title": "Synthesis of proteins by native chemical ligation",
      "authors_or_organization": "Dawson, P.E. et al.",
      "year": 1994,
      "source_type": "primary_research",
      "authority_posture": "primary_experimental",
      "primary_or_secondary": "primary",
      "doi": "10.1126/science.7637777",
      "pmid": 7637777,
      "accessed_date": "2026-07-10",
      "document_status": "active",
      "license_or_access": "subscription",
      "retraction_or_correction_status": "none",
      "claims_supported": ["native_chemical_ligation", "protein_synthesis", "peptide_ligation"],
      "exact_locators": "Science 266:776-779",
      "notes": "Foundational paper for native chemical ligation"
    },
    {
      "source_id": "PEP-ROBERTS-1997",
      "title": "mRNA display: a novel in vitro peptide/protein selection technique",
      "authors_or_organization": "Roberts, R.W. and Szostak, J.W.",
      "year": 1997,
      "source_type": "primary_research",
      "authority_posture": "primary_experimental",
      "primary_or_secondary": "primary",
      "doi": "10.1073/pnas.94.23.12297",
      "pmid": 9356447,
      "accessed_date": "2026-07-10",
      "document_status": "active",
      "license_or_access": "public",
      "retraction_or_correction_status": "none",
      "claims_supported": ["mrna_display", "in_vitro_selection", "peptide_library"],
      "exact_locators": "Proc Natl Acad Sci USA 94:12297-12302",
      "notes": "Foundational paper for mRNA display"
    },
    {
      "source_id": "PEP-HUNT-1992",
      "title": "Peptides presented to the immune system by MHC class I molecules",
      "authors_or_organization": "Hunt, D.F. et al.",
      "year": 1992,